title,description
"Introduction to Machine Learning","This course provides an overview of machine learning techniques, including supervised and unsupervised learning, neural networks, and more."
"Advanced Data Analysis","Learn advanced methods for analyzing data, including statistical techniques, data visualization, and predictive modeling."
"Web Development Fundamentals","A beginner's guide to web development, covering HTML, CSS, JavaScript, and basic front-end development skills."
"Project Management Essentials","An introduction to project management principles, including planning, execution, and monitoring of projects."
"Digital Marketing Strategies","Explore key strategies in digital marketing, including SEO, content marketing, social media, and email marketing."
"Introduction to Python Programming","Get started with Python programming, covering basic syntax, data structures, and simple algorithms."
"Data Science Bootcamp","An intensive bootcamp focused on data science skills, including data wrangling, analysis, and machine learning techniques."
"Cybersecurity Basics","An overview of cybersecurity principles, including threat types, prevention methods, and best practices for securing information."
"Financial Accounting Fundamentals","Understand the basics of financial accounting, including balance sheets, income statements, and cash flow analysis."
"Creative Writing Workshop","A workshop focused on developing creative writing skills, including fiction, poetry, and narrative techniques."
